Category,Customer_ID,Website,Comment,Label,Date
A1,1632,Amazon,thanks,positive,22.08.2024
A1,1633,Amazon,Awesome,positive,22.08.2024
A1,1634,Amazon,Smells bad when heated. Not good. Will not buy again.,Negative,22.08.2024
A1,1635,Amazon,Better,positive,22.08.2024
A1,1636,Amazon,Milavati h not pure ghee,Negative,22.08.2024
A1,1637,Amazon,"The quality of this ghee is quite good. I was fed up buying different company desi ghee and unfortunately those were not upto the mark, many of which looked artificial.

But this Nestle product helped me stop further search.",neutral,22.08.2024
A1,1638,Amazon,"The ghee although competitively priced, is very bland, lacks aroma and richness. Ok, for preparation of sweets where the ghee flavour is not required. For cooking and dishes you prepare this ghee may not suit.",Negative,22.08.2024
A1,1639,Amazon,Excellent,positive,22.08.2024
A1,1640,Amazon,Very Good Product...,positive,22.08.2024
A1,1641,Amazon,Superb every day,positive,22.08.2024
A1,1642,Amazon,Nice aroma,positive,22.08.2024
A1,1643,Amazon,Ananda and nestley is same,neutral,22.08.2024
A1,1644,Amazon,"Amongst the basket full of branded and nonbranded food items, Nestle has make a mark for itself. you can simply go for Nestle products without doubt, and Nestle Ghee is one amongst them. I trust it.",positive,22.08.2024
A1,1645,Amazon,Good product. Buy at reasonable price of 6H.,positive,22.08.2024
A1,1646,Amazon,What has to be done if we failed to cross check the status in my orders as no notification received and not delivered,Negative,22.08.2024
A1,1647,Amazon,It just doesn’t taste like ghee at all.dont know how is this manufactured .Looks like vanaspati. I would not recommend buying it.,Negative,22.08.2024
A1,1648,Amazon,Good,positive,22.08.2024
A1,1649,Amazon,Ghee with a taste of nature,positive,22.08.2024
A1,1650,Amazon,Test is good,positive,22.08.2024
A1,1651,Amazon,"Not Nad for trying but it's has very good color and texture as it supposed to be .

Fragrance in not 100%

But overall good purchase",neutral,22.08.2024
A1,1652,Amazon,"The product fragrance is very different, does not look like pure ghee.",Negative,22.08.2024
A1,1653,Amazon,Good,positive,22.08.2024
A1,1654,Amazon,"It’s ok ok product, texture is too fine, absolutely there’s no aroma of ghee. I will NOT buy it again",Negative,23.08.2024
A1,1655,Amazon,Bad,Negative,23.08.2024
A1,1656,Amazon,Noice product and price,positive,23.08.2024
A1,1657,Amazon,"its an average product in terms of usage, not so pure as desi ghee. Texture is very thick, flavor ok ok",Negative,23.08.2024
A1,1658,Amazon,Boht acha desi ghee hai ghar ke ghee jaisa swaad hai that’s why i loved everday pure desi ghee,positive,23.08.2024
A1,1659,Amazon,Good,positive,23.08.2024
A1,1660,Amazon,Nice??,positive,23.08.2024
A1,1661,Amazon,Good product,positive,23.08.2024
A1,1662,Amazon,Very very good ghee,positive,23.08.2024
A1,1663,Amazon,"My recent order was unexpectedly damaged.
But Amazon has solved the problem.
So, there is no issue with that..
Thanks Amazon. .",positive,23.08.2024
A1,1664,Amazon,Gheee is so tasty and A1 quality .,positive,23.08.2024
A1,1665,Amazon,The quality is very very bad donot but,Negative,23.08.2024
A1,1666,Amazon,"Satisfied with the product
I like it",positive,23.08.2024
A1,1667,Amazon,Full false ...not punjabi ghee...taste is more less and aroma also...please check quality OK..,Negative,23.08.2024
A1,1668,Amazon,Very good test,positive,23.08.2024
A1,1669,Amazon,good quality,positive,23.08.2024
A1,1670,Amazon,Good product from Nestle brand,positive,23.08.2024
A1,1671,Amazon,"Product is as per it's description, does not have any powerful cent in it but test is very good.",neutral,23.08.2024
A1,1672,Amazon,It's sixth time I have purchased it. It's really much better than all other similar products.,positive,23.08.2024
A1,1673,Amazon,Product is good but Seller is cheating by showing MRP as 525 and showing a discount being offered.. on the box its clearly mentioned as 500 only.. so basically no discount is there on this item,neutral,23.08.2024
A1,1674,Amazon,Ok,neutral,23.08.2024
A1,1675,Amazon,Much much better than the products available in the market,Negative,23.08.2024
A1,1676,Amazon,Average ghee in this price,neutral,23.08.2024
A1,1677,Amazon,The quality is very good.,positive,23.08.2024
A1,1678,Amazon,Good product,positive,23.08.2024
A1,1679,Amazon,the ghee in the market is sold in the name of cow ghee gir cow ghee charging sky high prices in the range of rs 600 to rs 2000 for one kg. it is trust which matters and nestle shahi ghee is pure ghee with good smell and aroma and is so reasonably priced. they are transparent about the milk they source the benefits the farmers get and the consistency and purity they deliver is worth every penny.,Negative,24.08.2024
A1,1680,Amazon,After frying with it the rest ghee smell bad,Negative,24.08.2024
A1,1681,Amazon,"The ghee is consistent texture, good colour and taste. Ideal for direct consumption as well as cooking. No wonder it goes out-of-stock very frequently.
I'd say please ignore the 1 star bad reviews some people have posted. Unless they were duped by the delivery person and delivered some alternate product (which is unlikely given Amazon service) I don't think the reviews are accurate.",neutral,24.08.2024
A1,1682,Amazon,I'm using it for last 2 years and never got any complaint or issue with tast and quality.,positive,24.08.2024
A1,1683,Amazon,Taste and freshness is good,positive,24.08.2024
A1,1684,Amazon,"The Quality, Taste and scent of the ghee are just like home made.
Biryani's sweets, halwa, paratha, puris or just patting it on your chapati makes
your food delicious and tasty. Value for money product. I would strongly
recommend it to all.",positive,24.08.2024
A1,1685,Amazon,I dont want to be waste my ghee in pot or fry pan it's this much valueable must be as just like marwadi keeps only beside khichdi smell and finish the khichdi. Flavor roming and and it will be reached to the next door. Dear this is every day shu'dha ghee once you try,Negative,24.08.2024
A1,1686,Amazon,U may have it,neutral,24.08.2024
A1,1687,Amazon,Taste not satisfied,Negative,24.08.2024
A1,1688,Amazon,Don't waste your money,Negative,24.08.2024
A1,1689,Amazon,"When I had bought it in Jan the consistency was different. As the temperatures increased, it melted well but now what's left is think vanaspati.
One could buy Vanspati for ?130/Kg instead of this adulterated ?500/kg ""Shahee Ghee"".",Negative,24.08.2024
A1,1690,Amazon,I won't buy it again,Negative,24.08.2024
A1,1691,Amazon,Very tasty ghee,positive,24.08.2024
A1,1692,Amazon,I am certified with my product,positive,24.08.2024
A1,1693,Amazon,good,positive,24.08.2024
A1,1694,Amazon,"Product is good, recommended",positive,24.08.2024
A1,1695,Amazon,Don't purchase damaged Product received,Negative,24.08.2024
A1,1696,Amazon,Worth the purchase. It does have slightly different scent but not that different.,neutral,24.08.2024
A1,1697,Amazon,Very good,positive,24.08.2024
A1,1698,Amazon,"This product is reasonable with it's price.
But, with respect to the quality, it's not completely converted into Ghee and still it's like butter. ??
Otherwise, it's good.",neutral,24.08.2024
A1,1699,Amazon,Meets expectations,positive,24.08.2024
A1,1700,Amazon,Enjoy fresh chapatis with a dash of Nesle Shahi Ghee or savour with sweets like simple 'sheera' prepared in this ghee. Enjoy.,positive,24.08.2024
A1,1701,Amazon,Good but aroma and flavor is missing,neutral,24.08.2024
A1,1702,Amazon,So disgusting.... There are some caterpillars in Nestle ghee.... Soo disgustingg..... Wrost service amazon.... No replacment...,Negative,24.08.2024
A1,1703,Amazon,"Quality was good, delivery was superfast.",positive,24.08.2024
A1,1704,Amazon,It is strange smell of course not of Ghee. It doesn't melt. There is definitely some issues with the product.. I have stopped taking this after few spoon,Negative,25.08.2024
A1,1705,Amazon,Don't purchase damaged Product received,Negative,25.08.2024
A1,1706,Amazon,What has to be done if we failed to cross check the status in my orders as no notification received and not delivered,Negative,25.08.2024
A1,1707,Amazon,It just doesn’t taste like ghee at all.dont know how is this manufactured .Looks like vanaspati. I would not recommend buying it.,Negative,25.08.2024
A1,1708,Amazon,Bad,Negative,25.08.2024
A1,1709,Amazon,The quality is very very bad donot but,Negative,25.08.2024
A1,1710,Amazon,After frying with it the rest ghee smell bad,Negative,25.08.2024
A1,1711,Amazon,Don't waste your money,Negative,25.08.2024
A1,1712,Amazon,"ve been a long-term consumer of this product. Never had any complaints. However, my recent purchase has been a total disappointment, health-wise and money-wise too. Unfortunately, I can't even return this product. So DON'T BUY unless Nestle starts taking QUALITY CHECKS seriously. Until then switch to a better alternative.",Negative,25.08.2024
A1,1713,Amazon,Quality is not good,Negative,25.08.2024
A1,1714,Amazon,It does not have ghee fragrance and no taste of ghee please don't buy,Negative,25.08.2024
A1,1715,Amazon,Don't waste your money. It's non returnable. No ghee smell and taste. It's like dalda. I don't recommend this product,Negative,25.08.2024
A1,1716,Amazon,Very bad quality.duplicate ghee.,Negative,25.08.2024
A1,1717,Amazon,Melting only on heating..But actual cow ghee melts at Chennai's hot temperature during summer. Bought considering the brand. But a big disappointment and feeling it a scam from the well known brand.,Negative,25.08.2024
A1,1718,Amazon,"Unbelievable. 60 % dalda mixed.. adulterated .. never expected from a branded company like nestle
Amazon should not hide comments
Most of the negative comments are hidden
The below one was the comment for my first purchase

I purchased the item for rs 530 few weeks back but increased rs 100 suddenly
Nice product like original ghee",Negative,25.08.2024
A1,1719,Amazon,Waste of money.. its just like dalda or vanaspati.. not at all good.. felt like Nestle company don't compromise on quality but that thinking was wrong ?? I wish to give negative value,Negative,25.08.2024
A1,1720,Amazon,I did not really felt like having ghee. First time tried this brand but didn't feel the taste or fragrance of ghee. It was bland like vanaspathi and mild taste of coconut oil.,Negative,25.08.2024
A1,1721,Amazon,This is not cow ghee . It’s a mix of cow and buffalo ghee. Don’t buy this item if you want pure cow ghee. Negligence of AMAZON SEARCH BAR.,Negative,25.08.2024
A1,1722,Amazon,It feels and taste like. Nothing shahi as mention. Better Nestle work on quality now.,Negative,25.08.2024
A1,1723,Amazon,It's not gee,Negative,25.08.2024
A1,1724,Amazon,It doesn't have any aroma or taste. Will be good to have my refund if possible.,Negative,25.08.2024
A1,1725,Amazon,Totally fraud Ibuy 2liters but it's mixed with refined oil not satisfied,Negative,25.08.2024
A1,1726,Amazon,This contains only dalda. Not pure ghee.,Negative,25.08.2024
A1,1727,Amazon,I know tastes are subjective but how do so many people like this??!! This doesn’t taste like ghee; doesn’t have an aroma. There’s nothing shahi or ghee about this product. First Nestle product that has disappointed me.,Negative,25.08.2024
A1,1728,Amazon,I did not expect this from a great company like Nestle. The quality of ghee was worst and was sub standard than any other local brands. Please do not go for this,Negative,25.08.2024
A1,1729,Amazon,"Didn't expect such bad quality from the brand like Nestle. No taste,no flavour,no scent. It doesn't taste like pure Desi ghee. I never buy ghee,this is for the 1st time I purchased ghee. I always prepare it at home so I know how exactly the pure ghee tastes. I just don't feel like eating this ghee. Very disappointed .",Negative,25.08.2024
A1,1730,Amazon,"I have sold more than 5 Packs of this ghee. Whom ever I sold they all complained me about the Bad smell of this ghee. Not only they complain about the odour but also they complained , I am selling them Dalda ghee in the name of Pure ghee. Finally I stop selling this ghee . Whom ever I sold this ghee, He did not ask me to sell for the second time. I stopped selling of this Product.",Negative,25.08.2024
A1,1731,Amazon,As per the company I thought the ghee would be good but it doesn't feel like I am using a ghee.It does not have any taste like a ghee nor does it have any aroma of ghee.The company really need to improve their product as per the price I feel like a local company would have delivered a better ghee than this.,Negative,25.08.2024
A1,1732,Amazon,There is nothing like Shahi and desi ghee. Dada mixed. I DON'T LIKE ITS TASTE. ??,Negative,25.08.2024
A1,1733,Amazon,Worst experience for this product. I have been using Nestle ghee for many year and never I got this type of bad and so much weak flavour. Eating this is not different from eating daalda with ghee smell only. Don't know this product is having only problem or nestle have lowered their quality for ghee. Very disappointed with this product. I want this to replaced but their is no option of even returning this or replacement. So total loss in this deal.,Negative,25.08.2024
A1,1734,Amazon,"This is absolutely adulterated substance. Has no properties like ghee.
No aroma, No granular texture (It might seem in the picture but in real it is a granular paste which is sticky), flavour is nothing like Ghee.
Please stay away from this product. Have tried it twice to be sure but both the times it has failed all the tests.",Negative,26.08.2024
A1,1735,Amazon,"Zero flavour, zero fragrance. Tried to save 100 bucks, wasted a whole month in using it",Negative,26.08.2024
A1,1736,Amazon,Not expecting this from Nestle brand. They have used potato in ghee to maintain the thickness. The scent is also very low. Would not recommend to anyone.,Negative,26.08.2024
A1,1737,Amazon,This is a very good item.Service is nice.,positive,26.08.2024
A1,1738,Amazon,I order 5 pouch of 1 litere each ghee and its manufacturing of first month ( jan)and exipry time is 9 months now the month of september going on iam very disappointed with this,Negative,26.08.2024
A1,1739,Amazon,"It has solid white particles, which doesn't dissolve even on heating, product is not ghee.",Negative,26.08.2024
A1,1740,Amazon,"Everything waste. No smell,taste and I felt like dalda. Really worst man. Who tasted original ghee will definitely vomit ??when you taste this. First time I am giving zero for a product. I've purchased more than 2k products in Amazon.com. from now I will not buy nestle products",Negative,26.08.2024
A1,1741,Amazon,It is not ghee in this product mixed dalda and quality is bad Don't waste your Money,Negative,26.08.2024
A1,1742,Amazon,"This product is very bad, same as dalda wanaspati",Negative,26.08.2024
A1,1743,Amazon,"Please don't buy in this product very bad smell coming and test is not like ghee i don't know what chemicals they mixed in this product ..
So please be careful if you buy this product ..and it's not returnable .I wish no one wast money on this product ..",Negative,26.08.2024
A1,1744,Amazon,Received Rotten Ghee & not being returned,Negative,26.08.2024
A1,1745,Amazon,This ghee has no quality and it doesn't worth to buy. Recommended to stay away from it.,Negative,26.08.2024
A1,1746,Amazon,Very poor quality product. Don't buy this ghee from Amazon.,Negative,26.08.2024
A1,1747,Amazon,"Its a worst product 90% Dalda Ghee mix, Dont Buy it",Negative,26.08.2024
A1,1748,Amazon,"Dalda mix, nauseating",Negative,26.08.2024
A1,1749,Amazon,"There is smell in ghee, doesn’t smell like fresh. Taste is also not good.",Negative,26.08.2024
A1,1750,Amazon,Bad,Negative,26.08.2024
A1,1751,Amazon,Smell is not of Desi ghee,Negative,26.08.2024
A1,1752,Amazon,It's not pure ghee. Don't buy this.,Negative,26.08.2024
A1,1753,Amazon,Clearly palm oil with some ghee crystals in it,Negative,26.08.2024
A1,1754,Amazon,Worst Product,Negative,26.08.2024
A1,1755,Amazon,"Fully waste of money
There is no smell of ghee",Negative,26.08.2024
A1,1756,Amazon,Consistency Very Thin like oil,Negative,26.08.2024
A1,1757,Amazon,"It old stock about to expire just 3 months to expire.
Some bad smell comes from the ghee.
Not satisfied with this product.",Negative,26.08.2024
A1,1758,Amazon,"This ghee is not refined. Compare this with Nandhini ghee, you will understand the difference. Needs to be boiled again to make it as ghee. Ghee should be mostly liquid and only 10 percentage should be semi-solid, but this ghee looks like vanaspati",Negative,26.08.2024
A1,1759,Amazon,Waste of money,Negative,26.08.2024
A1,1760,Amazon,No smell no taste very runny consistency. It's like oil.,Negative,26.08.2024
A1,1761,Amazon,Very worst in taste and in aroma ! For a price of 470 it is not worth !! Better Nestle should consider customer and their money spent,Negative,26.08.2024
A1,1762,Amazon,Not pure ghee vansapti ghee mix no aroma,Negative,26.08.2024
A1,1763,Amazon,No,Negative,26.08.2024
A1,1764,Amazon,"Worst ghee I have ever tasted. Aroma and flavor is not even close to other ghee products that I have used. The product tastes more like DALDA. I would surely not recommend anyone to buy this. Other ghee products from Nandini, Patanjali and GRB are far better than this.",Negative,27.08.2024
A1,1765,Amazon,"Dublicate product full mixed with dalta worst
It's eatable vegetarian product worst way to make money plz avoid",Negative,27.08.2024
A1,1766,Amazon,Everything is good but it is going to expire in one month ??.,Negative,27.08.2024
A1,1767,Amazon,Received nestle ghee box damaged (crushed). Not expected,Negative,27.08.2024
A1,1768,Amazon,"Although packaging was good, the quality of ghee was very poor. The flavour and scent was of DALDA ghee where in cow ghee is only mixed in very less percentage/quantity.

We purchased it looking at the BRAND, but can't trust it anymore.",neutral,27.08.2024
A1,1769,Amazon,"Dont buy this product, its bad in taste. Dont take even it's free. . . . . . . .",Negative,27.08.2024
A1,1770,Amazon,Not satisfied,Negative,27.08.2024
A1,1771,Amazon,"Do not compromise with health,it is totaly vanaspati.Nestle cheated with 130 crore innocent indian people.Go with only Patanjali Ghee and never buy this worst and fake product, if u sincere to health.",Negative,27.08.2024
A1,1772,Amazon,"The ghee instead of being semi solid..was hard enough. It resemled more like ""Dalda Vanaspati"" rather than ghee. Full wastage of money.",Negative,27.08.2024
A1,1773,Amazon,"Shahi ghee is pathetic, neither taste nor color nor the granular texture. This is anything but ghee.
Big thumbs down to Nestle.",Negative,27.08.2024
A1,1774,Amazon,"It's not like ghee , totaly worsen products don't wast money",Negative,27.08.2024
A1,1775,Amazon,Bad product,Negative,27.08.2024
A1,1776,Amazon,"Worst taste, it’s not a ghee 200% vanaspathi / dalda, not ghee at all. Complete waste of money. I never ever buy this anymore in my life time, also I not recommend this to any ghee lovers",Negative,27.08.2024
A1,1777,Amazon,Worst flavor worst?? scent 0 percent value for money it's not ghee it's 100 percent daldal vanaspati bad bad bad product by nestle,Negative,27.08.2024
A1,1778,Amazon,Its older package. Going to be expired soon,Negative,27.08.2024
A1,1779,Amazon,This is the first time we had bought ghee. We used to always prepare it at home. There is no flavor or scent in it. Please go without eating ghee than choosing this.,Negative,27.08.2024
A1,1780,Amazon,Don't buy and waste your money it's not ghee very worst product in name of nestle,Negative,27.08.2024
A1,1781,Amazon,"There is no odour and bad taste, even Amazon customer service also not at all helpful, I throwed in dustbin, nestle need to do quality check",Negative,27.08.2024
A1,1782,Amazon,This doesn't look or taste like desi ghee. Taste is not at all like pure ghee. I don't know how come it is 4 star rating.,Negative,27.08.2024
A1,1783,Amazon,No smell no color waste of money,Negative,27.08.2024
A1,1784,Amazon,Did not expect such poor quality from brand like NESTLE!!!!! Now I understand why majority of customers gave it low rating,Negative,27.08.2024
A1,1785,Amazon,Don't buy this products it is expired,Negative,27.08.2024
A1,1786,Amazon,"Just line oil with vanaspathi
Worst experience",Negative,27.08.2024
A1,1787,Amazon,Instead of two packs of everyday ghee only one has been sent while I have made for two. Shocking!,Negative,27.08.2024
A1,1788,Amazon,Not good,Negative,27.08.2024
A1,1789,Amazon,I sent an email to Nestle and they said it's 75% cow rest is buffalo ghee,Negative,27.08.2024
A1,1790,Amazon,Waste of money,Negative,27.08.2024
A1,1791,Amazon,Very much taste like vanspati ghee (dalda 60%),Negative,27.08.2024
A1,1792,Amazon,Smells bad when heated. Not good. Will not buy again.,Negative,27.08.2024
A1,1793,Amazon,Milavati h not pure ghee,Negative,27.08.2024
A1,1794,Amazon,"It’s ok ok product, texture is too fine, absolutely there’s no aroma of ghee. I will NOT buy it again",Negative,27.08.2024
A1,1795,Amazon,"This is Honest Review, this pack has ghee but 50%",Negative,27.08.2024
A1,1796,Amazon,"The aroma and flavour are not good as expected, compared to other popular brands in the market.",Negative,27.08.2024
A1,1797,Amazon,"Don't waste your money on it, no taste at all.",Negative,27.08.2024
A1,1798,Amazon,I was impressed by the title Shahi ghee but was very disappointed. It does not taste like ghee. Waste of money.,Negative,27.08.2024
A1,1799,Amazon,Smell not good,Negative,27.08.2024
A1,1800,Amazon,No flavour or essence at all,Negative,27.08.2024
A1,1801,Amazon,Not good ghee I used it for making briyani . No smell and also Ghee become very foamy and need to use lots of it to get taste. I think it is not good quality ghee.,Negative,27.08.2024
A1,1802,Amazon,"No Taste, flavourless,",Negative,27.08.2024
A1,1803,Amazon,"There is no taste or smell for this ghee.
Wouldn't recommend this to anyone.",Negative,27.08.2024
A1,1804,Amazon,Tastes like dalda,Negative,28.08.2024
A1,1805,Amazon,"Very bad ghee . It's more like butter . It isn't the pure ghee indians are used to . It doesn't have the texture or the aroma of a ghee . Colour is also different. This is a big negative as compared to the ghee offered by other companies such as itc , brittania etc . Expected much better from nestle. Waste of money.",Negative,28.08.2024
A1,1806,Amazon,"Received on Sept 25, expiring on Nov 24, 2022. This is a stock clearing product.",Negative,28.08.2024
A1,1807,Amazon,NESTLE EVERYDAY SHAHI GHEE not suggest to purchase,Negative,28.08.2024
A1,1808,Amazon,My mother said the quality is very low dont buy,Negative,28.08.2024
A1,1809,Amazon,"No doubt in Mother Dairy , but the item has spillage issue",Negative,28.08.2024
A1,1810,Amazon,not ghee dublicate dissapoint,Negative,28.08.2024
A1,1811,Amazon,Expired date in 3 month.,Negative,28.08.2024
A1,1812,Amazon,Not good,Negative,28.08.2024
A1,1813,Amazon,The product started stinking after 3days of opening and milk soilds were separated from the oils and could it floating.,Negative,28.08.2024
A1,1814,Amazon,Its a semi baked ghee with no odor or taste.,Negative,28.08.2024
A1,1815,Amazon,"This not real desi ghee. It does not smells like desi ghee, i think 80% of banaspati ghee (Dalda ghee) is added in to this. So don't go for it. It's not real.",Negative,28.08.2024
A1,1816,Amazon,No its not like a deshi ghee,Negative,28.08.2024
A1,1817,Amazon,"No aroma of ghee, compared to Ashirwad Ghee of ITC. Would never go for it in future.",Negative,28.08.2024
A1,1818,Amazon,"While I liked the ghee texture and color, yet, it gives no smell. Made Modak fully out of ghee, no smell at all.",Negative,28.08.2024
A1,1819,Amazon,No Aroma,Negative,28.08.2024
A1,1820,Amazon,Nestle has maintained its quality till date,Negative,28.08.2024
A1,1821,Amazon,Poor in smell and poor in taste cheap quality product from Nestle,Negative,28.08.2024
A1,1822,Amazon,Not good product better to go with Ashirwaad ghee,Negative,28.08.2024
A1,1823,Amazon,It does not taste like desi ghee waste of money no taste and seems like dalda ghee,Negative,28.08.2024
A1,1824,Amazon,No flavour and scent of Desi ghee. Also very pasty in texture.,Negative,28.08.2024
A1,1825,Amazon,Its not ghee,Negative,28.08.2024
A1,1826,Amazon,not desi ghee at all.,Negative,28.08.2024
A1,1827,Amazon,Not gud.i dont like smell of it.,Negative,28.08.2024
A1,1828,Amazon,"Very bad tight ghee
I don't like it.",Negative,28.08.2024
A1,1829,Amazon,Horrible taste,Negative,28.08.2024
A1,1830,Amazon,Product is not good because mix of refind in ghee,Negative,28.08.2024
A1,1831,Amazon,Not pure ghee.,Negative,28.08.2024
A1,1832,Amazon,"It is substandard quality. Not worth the money
Helpful
Report",Negative,28.08.2024
A1,1833,Amazon,Good product,positive,28.08.2024
A1,1834,Amazon,Cheap quality,Negative,28.08.2024
A1,1835,Amazon,Flavor was not as expected.,Negative,28.08.2024
A1,1836,Amazon,"No flavor of ghee
Too thick to be ghee",Negative,28.08.2024
A1,1837,Amazon,It is 85 : 15 dalda and vegetable full false of cow from Punjab .,Negative,28.08.2024
A1,1838,Amazon,Not good quality,Negative,28.08.2024
A1,1839,Amazon,"Not seems original, no smell like good Ghee.",Negative,28.08.2024
A1,1840,Amazon,Not bad,Negative,28.08.2024
A1,1841,Amazon,I paid Rs450 for it,Negative,28.08.2024
A1,1842,Amazon,You can use it but can't add in your fav,Negative,28.08.2024
A1,1843,Amazon,"The ghee although competitively priced, is very bland, lacks aroma and richness. Ok, for preparation of sweets where the ghee flavour is not required. For cooking and dishes you prepare this ghee may not suit.",Negative,28.08.2024
A1,1844,Amazon,"The product fragrance is very different, does not look like pure ghee.",Negative,28.08.2024
