Category,Customer_ID,Website,Comment,Label,Date
A1,1105,Amazon,Product is good. And seal pack.,Positive,01.08.2024
A1,1106,Amazon,However when we go to buy again the price has been increasing from 585 to 610. Unfair price policy.,Negative,01.08.2024
A1,1107,Amazon,Cheaper than anywhere,Neutral,01.08.2024
A1,1108,Amazon,Ordered it first time and pretty satisfied with the taste texture and aroma,Positive,01.08.2024
A1,1109,Amazon,Very good quality product,Positive,01.08.2024
A1,1110,Amazon,Quick delivery iin total good.,Neutral,01.08.2024
A1,1111,Amazon,Tastes good when used for cooking.,Positive,01.08.2024
A1,1112,Amazon,"The Ghee was not of that fresh stock..taste also little bitter..
Bcoz I know nandini ghee smells really good if it's fresh n taste also good.. That's why I purchased the ghee.",Negative,01.08.2024
A1,1113,Amazon,So good I can’t resist buying it every month,Positive,01.08.2024
A1,1114,Amazon,The quality and colour is good but I have not found any Aroma of the product,Negative,01.08.2024
A1,1115,Amazon,Very Good ghee from Nandini.,Positive,01.08.2024
A1,1116,Amazon,"Original product
I like to buy again
Thank you amezon",Positive,01.08.2024
A1,1117,Amazon,Lovely ghee. Worth the price.,Positive,01.08.2024
A1,1118,Amazon,Best quality ghee as always,Positive,01.08.2024
A1,1119,Amazon,"Very good product from nandini, it's pure and tasty.",Positive,01.08.2024
A1,1120,Amazon,Its smell soo good,Positive,01.08.2024
A1,1121,Amazon,There's no consistency in quality and it has completely deteriorated. I am not even sure whether it is original or duplicate. It is very thick and smells horrible when you heat. Taste is like dalda. Thick lumps are there in the ghee which don't melt easily. Also you can see a huge difference in price online vs Nandini booth price. Looks like spurious product is being sold online,Negative,01.08.2024
A1,1122,Amazon,Good,Positive,01.08.2024
A1,1123,Amazon,Good taste and good fragrance,Positive,01.08.2024
A1,1124,Amazon,"We r using Nandini Ghee since 5+ yrs. This time purchased from Amazon. Not satisfied with this. Ghee is too thick, there is difference in colour and taste too. Even at 40°c in Bangalore the Ghee was very thick. Pure Nandini Ghee will liquify at temperature beyond 30°c. I am sure what I received was duplicate of Nandini",Negative,02.08.2024
A1,1125,Amazon,"Fake product received, found white lump with ghee",Negative,02.08.2024
A1,1126,Amazon,"The purest form of clarified butter or ghee....
I've ordered first time and Mark my words, the aroma, flavour is in its purest form,
I've not seen such kind of ghee in my LIFETIME
it's cheap compared to others, but should have been higher price.
But quality of ghee is best nowhere to be found.
Just pay for it and thank you Amazon for faster delivery, it was expected waiting for 1 month but Amazon is god, it delivered within 5 days of purchase",Positive,02.08.2024
A1,1127,Amazon,Satisfied with Quality & Delivery of Fresh,Positive,02.08.2024
A1,1128,Amazon,Good and reasonably priced product.,Positive,02.08.2024
A1,1129,Amazon,Product was damaged otherwise Nandhin products are always great.,Neutral,02.08.2024
A1,1130,Amazon,Best buy,Positive,02.08.2024
A1,1131,Amazon,It’s quite good.,Positive,02.08.2024
A1,1132,Amazon,Using from last 15years. Trusted brand with better quality and aroma.,Positive,02.08.2024
A1,1133,Amazon,"Perfect Quality, Great Taste and Healthy, Thank you so much. We are in awe of Nandini products since our childhood days.",Positive,02.08.2024
A1,1134,Amazon,Have stopped ordering nandini ghee from Amazon cos in the past few months received old stocks everytime. Earlier they used to give fresh stocks not more than a month old. However off late even got stocks more than 6 months old. Dairy products may have a shelf life but are best consumed when they are as fresh as possible. Am buying it offline since then,Negative,02.08.2024
A1,1135,Amazon,"No other Ghee comparable. Have tried ghee varieties from Pynhab, Andhra, Tamil Nadu. Their melting point perhaps low for retaining water content. Even in summer such varieties donot melt.Nandi i from KMF is like home made ghee.Flavour,consistency,long shelf life top class.",Positive,02.08.2024
A1,1136,Amazon,Quality is good but rate is less in flipcart,Neutral,02.08.2024
A1,1137,Amazon,"Will never purchase online, ghee is adulterated. I took out the white boondi from ghee and taste it, it was not even smelling and tasting like a ghee.",Negative,02.08.2024
A1,1138,Amazon,Nice n pure .good flavour,Positive,02.08.2024
A1,1139,Amazon,Excellent quality and taste,Positive,03.08.2024
A1,1140,Amazon,The ghee looks impure. It is a mixture of something which doesn't even melt when heated.,Negative,03.08.2024
A1,1141,Amazon,"This guy is prepared by the Karnataka milk federation Bangalore and it is a good ghee for use in kitchen or any other similar purpose. I am not sure that he is prepared which milk maybe cow or buffalo but it is a good guy and I give the five stars for the same.
I thanks to Amazon India for providing a platform for the product of other states p",Positive,03.08.2024
A1,1142,Amazon,Nandini Ghee is pure and good,Positive,03.08.2024
A1,1143,Amazon,"I like the flavour,texture and use it regularly.good product.",Positive,03.08.2024
A1,1144,Amazon,"I may be biased, but I have grown up using Nandini Ghee and trust the quality. Excellent flavour and taste over other commercial brands and even better that A2 advertised brands. Best price so this is superb quality for a really great price. Will buy again.",Positive,03.08.2024
A1,1145,Amazon,Wow super,Positive,03.08.2024
A1,1146,Amazon,"Liked everything about it specially for its purity, taste etc.",Positive,03.08.2024
A1,1147,Amazon,I like the packaging. But I was expecting 1kg packets. I have ordered 3kg soo i have received 6 packets of 500gm.. price is also very high according to karnataka state.. but i m getting in delhi thats a good thing..,Negative,03.08.2024
A1,1148,Amazon,Tastes best. Have been using this for years,Positive,03.08.2024
A1,1149,Amazon,"Flavour is awesome.
It's smells like home made ghee.
Nandini one of the top trusted brand.
Packaging also good.
But charged us more than MRP.
MRP is 450/- and we paid ?590/- including delivery charges.
Delivery charge is too high.",Neutral,03.08.2024
A1,1150,Amazon,The Ghee sachet of 1L delivered was of good quality and well within the expiry date for the product.,Positive,03.08.2024
A1,1151,Amazon,Flavor and aroma damn good. Go for it,Positive,03.08.2024
A1,1152,Amazon,Complete adulterated product. 50% pure ghee and 50% Vanaspati. Please do not purchase. On heating the granules take more time to melt.,Negative,03.08.2024
A1,1153,Amazon,It is a Government of Karnataka backed company product. Can be sure that it is pure and fresh.,Positive,03.08.2024
A1,1154,Flipkart,Good,Positive,03.08.2024
A1,1155,Flipkart,Very good item,Positive,03.08.2024
A1,1156,Flipkart,Awesome products,Positive,03.08.2024
A1,1157,Flipkart,Superb,Positive,03.08.2024
A1,1158,Flipkart,It's really very good product real value of money,Positive,03.08.2024
A1,1159,Flipkart,Very good product I liked it they reached at the time,Neutral,04.08.2024
A1,1160,Flipkart,Very good,Positive,04.08.2024
A1,1161,Flipkart,Very nice,Positive,04.08.2024
A1,1162,Flipkart,Nice. Good,Positive,04.08.2024
A1,1163,Flipkart,Good quality ghee in a reasonable price. Happy and using it regularly.,Positive,04.08.2024
A1,1164,Flipkart,Good,Positive,04.08.2024
A1,1165,Flipkart,Nice,Positive,04.08.2024
A1,1166,Flipkart,Nice product,Positive,04.08.2024
A1,1167,Flipkart,Super fast delivery with minimal calls.,Neutral,04.08.2024
A1,1168,Flipkart,Good,Positive,04.08.2024
A1,1169,Flipkart,Very good,Positive,04.08.2024
A1,1170,Flipkart,Good,Positive,04.08.2024
A1,1171,Flipkart,Excellent,Positive,04.08.2024
A1,1172,Flipkart,Great experience. Quick response and resolved the issue on priority basis. Thumbs up.,Positive,04.08.2024
A1,1173,Flipkart,Good,Positive,04.08.2024
A1,1174,Flipkart,Not pure,Negative,05.08.2024
A1,1175,Flipkart,Nice and cheap compared to other supermarket,Positive,05.08.2024
A1,1176,Flipkart,This is nice and good job thankyou,Positive,05.08.2024
A1,1177,Flipkart,Quality is very good,Positive,05.08.2024
A1,1178,Big Basket,"this is a dangerous and fake product..my wife and daughter fell ill over the past few days and we realised that only they had been consuming this with milk unheated ..To confirm suspicion, we placed in fridge and it turned white..on heating up the ghee it turned into clear liquid and smells of mineral oil...bright yellow liquid has also turned clear...the mineral oil is sticking to the sides of pan like a film...it is not resolidifying ..this is a serious offense...pictures are attached",Negative,05.08.2024
A1,1179,Big Basket,"I doubt the genuineness of the nadini ghee. earlier, there was no such complain. it seems the product is adulterated..",Negative,05.08.2024
A1,1180,Big Basket,Have been using nandini products for a long time. First time i ordered it on bigbasket and the other was just off and nandini ghee is yellow is colour. This was white in colour. Ended up throwing it out. Fake product.,Negative,05.08.2024
A1,1181,Big Basket,NO taste,Negative,05.08.2024
A1,1182,Big Basket,"dissapointed with ghee because of tasteless ghee and no smell, taste like ground nut oil",Negative,05.08.2024
A1,1183,Big Basket,I ordered for cow ghee.. but I got buffalo ghee,Negative,05.08.2024
A1,1184,Big Basket,quality is not good bad smell,Negative,05.08.2024
A1,1185,Big Basket,good,Positive,05.08.2024
A1,1186,Big Basket,it is not apure ghee and also it is not cow ghee as written on it,Negative,05.08.2024
A1,1187,Big Basket,"This isn’t pure gee at all, it’s totally adulterated. Bigbasket please get Nandini gee from the Nandini Parlor. This gee has turned totally tasteless and colour less after heating it.",Negative,05.08.2024
A1,1188,Big Basket,it is so pure ghee asa a home ghee,Positive,05.08.2024
A1,1189,Big Basket,Superb,Positive,05.08.2024
A1,1190,Big Basket,smell not good,Negative,05.08.2024
A1,1191,Big Basket,Don't know why but it didn't have the aroma which generally ghee has when used. Also didn't taste good,Negative,05.08.2024
A1,1192,Big Basket,the quality of ghee is really bad and it is smelly.,Negative,05.08.2024
A1,1193,Big Basket,It’s very disappointing that a Nandini brand ghee is tasteless and mix. I found white hard particle in ghee. Its not eatable and I opened packet that I can’t return it . Waste of money and harmful for human body I think. Rice grain I think it’s mix. Do something on these kind of feedback,Negative,05.08.2024
A1,1194,Big Basket,ghee not good quality.,Negative,05.08.2024
A1,1195,Big Basket,it gives a very natural smell and taste and good health this product is amazing pure and natural and gives a very good health,Positive,05.08.2024
A1,1196,Big Basket,It is not original Nandini. it seems to be adulterated. The quality was very bad,Negative,05.08.2024
A1,1197,Big Basket,"Good, fresh & taste aroma was nice",Positive,05.08.2024
A1,1198,Big Basket,fake product,Negative,05.08.2024
A1,1199,Big Basket,All products from Big Basket are extremely good in quality and hygienically packed.The tase and the smell is simply amazing.,Positive,05.08.2024
A1,1200,Big Basket,Excellent Aroma. Long lasting taste. Very economically priced,Positive,06.08.2024
A1,1201,Big Basket,Nice Aroma and Taste... Price in to our Buget....,Positive,06.08.2024
A1,1202,Big Basket,quality is not good,Negative,06.08.2024
A1,1203,Big Basket,it's more oil then ghee,Negative,06.08.2024
A1,1204,Big Basket,taste is not like original ghee.,Negative,06.08.2024
A1,1205,Big Basket,ghee tastes genuine and not adulterated,Positive,06.08.2024
A1,1206,Big Basket,it is not ghee..it looks like vanaspati or palm oil..very bad product.The worst ghee have ever bought.,Positive,06.08.2024
A1,1207,Big Basket,"Awesome ghee! the best ghee available in India, no brand can match Nandini dairy products!!",Positive,06.08.2024
A1,1208,Big Basket,Really this is something. Taste is excellent. Just wow. No other ghee’s like this in the market. It’s another level ghee,Positive,06.08.2024
A1,1209,Big Basket,The ghee has brown fragments in it and does not look pure.,Negative,06.08.2024
A1,1210,Big Basket,Good Aroma... Well Fresh.. Budget Friendly For My Restaurant... Thanks BB..,Positive,06.08.2024
A1,1211,Big Basket,It's not pure ghee don't go for it. Earlier i have brought Nandini ghee from shop it was nice and tasty. This one I ordered from bb and found like some waxy granules.,Negative,06.08.2024
A1,1212,Amazon,The product was identical to what I searched for. Nicely packed for delivery as it's a fluid item. Cost less than other grocery portals.,Positive,06.08.2024
A1,1213,Amazon,Quality is good,Positive,06.08.2024
A1,1214,Amazon,Excellent quality of the company as well as the service provided by amazon. Thanks amazon.,Positive,06.08.2024
A1,1215,Amazon,No taste of ghee beter I purchase from my village,Negative,06.08.2024
A1,1216,Amazon,Good quality and smells amazing,Positive,06.08.2024
A1,1217,Amazon,"Taste is good ,got divery on time, price is reasonable
All products of this company are of very good quality",Positive,06.08.2024
A1,1218,Amazon,Price is too high,Negative,06.08.2024
A1,1219,Amazon,Product damaged manufacturing date not written correctly,Negative,06.08.2024
A1,1220,Amazon,Very good product with quality and on time delivery. Just loving it. A happy customer.,Positive,06.08.2024
A1,1221,Flipkart,Has no flavor at all.,Negative,06.08.2024
A1,1222,Flipkart,Quality not as per expectations.,Negative,06.08.2024
A1,1223,Flipkart,It's a nice quality and wonderful service of Flipkart organisation many more thanks to you and your family,Positive,06.08.2024
A1,1224,Flipkart,Tasty and best quality,Positive,06.08.2024
A1,1225,Flipkart,Very bad no smell of ghee,Negative,07.08.2024
A1,1226,Flipkart,Test is very bad and quality is also bad,Negative,07.08.2024
A1,1227,Flipkart,Very bad,Negative,07.08.2024
A1,1228,Flipkart,Indeed very good product and service,Positive,07.08.2024
A1,1229,Flipkart,Packing is ok but delicate items should be packed properly,Neutral,07.08.2024
A1,1230,Flipkart,It is not ghee. Its dalda.,Negative,07.08.2024
A1,1231,Flipkart,Very bad product. Smells bad and no taste of ghee.,Negative,07.08.2024
A1,1232,Flipkart,Taste is not real and clearly vanaspati dalda is mixed which accumulates in the bottom. Ghee should be so flavourful and with awesome aroma that even if our stomach is full but hunger is still there for more after smelling that ghee.,Negative,07.08.2024
A1,1233,Flipkart,Quality is of poor.,Negative,07.08.2024
A1,1234,Flipkart,The Amul ghee quality is good,Positive,07.08.2024
A1,1235,Flipkart,No scent no taste.,Negative,07.08.2024
A1,1236,Flipkart,delivery on time and original product received,Positive,07.08.2024
A1,1237,Flipkart,Useless product. This is not at all ghee. If you boils no aroma. It looks like some oil,Negative,07.08.2024
A1,1238,Flipkart,Product packing and product is very good.,Positive,07.08.2024
A1,1239,Flipkart,"Best in class, Aroma , purest ghee",Positive,07.08.2024
A1,1240,Flipkart,Quality of the product very worst,Negative,07.08.2024
A1,1241,Flipkart,Fresh. Product,Positive,07.08.2024
A1,1242,Flipkart,Very delicious,Positive,07.08.2024
A1,1243,Flipkart,Good but quite costly,Neutral,07.08.2024
A1,1244,Flipkart,nice,Positive,07.08.2024
A1,1245,Flipkart,Good Quality,Positive,07.08.2024
A1,1246,Amazon,The size in Amazon pic is different.The one we got was quite small.but the ghee is pure and tast,Neutral,07.08.2024
A1,1247,Amazon,The size in Amazon pic is different.The one we got was quite small.but the ghee is pure and tast,Positive,07.08.2024
A1,1248,Amazon,Amul is best and this product don’t have any difference…,Positive,07.08.2024
A1,1249,Amazon,Amul is best.. For ever. Thanks,Positive,07.08.2024
A1,1250,Amazon,"The taste and texture soft ,freshJist litle too much tick.",Positive,07.08.2024
A1,1251,Amazon,Value for money product. Very good quality as is expected from a trusted brand.,Positive,07.08.2024
A1,1252,Amazon,No Aroma even though it says 'High Aroma'.,Negative,07.08.2024
A1,1253,Amazon,Very much disappointed,Negative,07.08.2024
A1,1254,Amazon,Very good,Positive,08.08.2024
A1,1255,Amazon,Good for daily consumption. It has good taste and great to have in an empty stomach. It has good taste,Positive,08.08.2024
A1,1256,Amazon,Excellent product,Positive,08.08.2024
A1,1257,Amazon,Ghee is as expected but thought the container was glass as it is mentioned as “Jar”,Neutral,08.08.2024
A1,1258,Amazon,Ghee is in good consistency,Positive,08.08.2024
A1,1259,Amazon,The Ghee is superb. But the packing is not good. Some ghee spilled out of the bottle. Please give more attention in make the packing more tight,Neutral,08.08.2024
A1,1260,Big Basket,very bad quality. very impure product with vanaspati adulteration. i have opened packet and used abt 100 gms. It would be great if you could confirm replacement.,Negative,08.08.2024
A1,1261,Big Basket,it's very bad .... I am son of Farmer so I request you all do not purchase cow Ghee in this app,Negative,08.08.2024
A1,1262,Big Basket,"whenever I had purchase the Sumul or amul cow ghee from the Big basket, always deleivered old items. today it's 12th August & on product packing date is 30th June. in past already said this problem & got the promise from Big basket that in future you will not face further issue. really disappointed.",Negative,08.08.2024
A1,1263,Big Basket,very bad quality. very impure product with vanaspati adulteration. i have opened packet and used abt 100 gms. It would be great if you could confirm replacement.,Negative,08.08.2024
A1,1264,Big Basket,"The name 'AMUL' itself is enough. Genuine Product, Original taste",Positive,08.08.2024
A1,1265,Big Basket,i have Doubt about quality because if it Cow ghee it should remain yellow even in pan. but I have observed after heating it becomes pure white. That is a matter of concern and also proves it is not pure cow ghee. Maybe just yellow colour is added.,Negative,08.08.2024
A1,1266,Big Basket,"quality is very poor and it seems like they have mixed dalda or something else but it's not at all pure ghee, looking at brand name I have purchased but now regretting.",Negative,08.08.2024
A1,1267,Big Basket,quantity issue found as this seems inferior quality,Negative,08.08.2024
A1,1268,Big Basket,doesnot look like ghee 75% id dalda..do not buy this product,Negative,08.08.2024
A1,1269,Big Basket,Cow ghee wasn't sent plain Amul ghee was in the basket,Negative,08.08.2024
A1,1270,Big Basket,excellent,Positive,08.08.2024
A1,1271,Big Basket,stale and quality is bad,Negative,08.08.2024
A1,1272,Big Basket,"WORST ever ghee I have ever had. Such a bad ghee. no taste , no fragrance. Spoilt. taste like oil NEED REFUND.",Negative,08.08.2024
A1,1273,Big Basket,its not taste as a cow ghee.,Negative,08.08.2024
A1,1274,Big Basket,ast delivery and good discounts.,Neutral,09.08.2024
A1,1275,Big Basket,Pathetic quality,Negative,09.08.2024
A1,1276,Big Basket,t has dalda like consistency and doesn't even taste like ghee.,Negative,09.08.2024
A1,1277,Big Basket,it's definitely not ghee. I wish I could give negative ratings. no flavour no aroma..even texture is not of ghee. I'm not sure weather it's fit for consumption. spurious,Negative,09.08.2024
A1,1278,Big Basket,poor quality ghee,Negative,09.08.2024
A1,1279,Big Basket,flavourful and tasty ghee,Positive,09.08.2024
A1,1280,Big Basket,"Pure Dalda, not at all ghee, never buying Amul products again.",Negative,09.08.2024
A1,1281,Big Basket,yes.Good product,Positive,09.08.2024
A1,1282,Big Basket,Good but costly,Neutral,09.08.2024
A1,1283,Big Basket,good taste and quality,Positive,09.08.2024
A1,1284,Big Basket,as expected,Neutral,09.08.2024
A1,1285,Big Basket,good with nice discount,Positive,09.08.2024
A1,1286,Big Basket,"very nice, awesome",Positive,09.08.2024
A1,1287,Big Basket,worst don't buy,Negative,09.08.2024
A1,1288,Big Basket,satisfactory,Neutral,09.08.2024
A1,1289,Big Basket,not at all pure ghee.it taste like vanaspasti. I m very disappointed vt this item,Negative,09.08.2024
A1,1290,Big Basket,Very good,Positive,09.08.2024
A1,1291,Big Basket,Very good reasionable price,Positive,09.08.2024
A1,1292,Big Basket,this is a very good product,Positive,09.08.2024
A1,1293,Big Basket,good,Positive,09.08.2024
A1,1294,Big Basket,good,Positive,09.08.2024
A1,1295,Big Basket,good,Positive,09.08.2024
A1,1296,Big Basket,The best item offered at rock-bottom price,Positive,09.08.2024
A1,1297,Big Basket,cow ghee great flavour Good product value for money,Positive,09.08.2024
A1,1298,Big Basket,excellent aroma and texture. best ghee to buy,Positive,09.08.2024
A1,1299,Big Basket,Aroma is natural specially parathas,Positive,10.08.2024
A1,1300,Big Basket,Good buying regularly,Positive,10.08.2024
A1,1301,Big Basket,Old Stock Amul Cow Ghee.& oil type,Negative,10.08.2024
A1,1302,Big Basket,"Amul cow ghee is of very good quality. yellowish colour, nice taste.",Positive,10.08.2024
A1,1303,Big Basket,"worth , excellent in this item is exciting discount",Positive,10.08.2024
A1,1304,Big Basket,Tried it for the first time.... Happy about the quality,Positive,10.08.2024
A1,1305,Big Basket,Good Quality,Positive,10.08.2024
A1,1306,Big Basket,Best Ghee,Positive,10.08.2024
A1,1307,Big Basket,very good,Positive,10.08.2024
A1,1308,Big Basket,we used first time cow ghee so can not compare but will not order again as there is NO taste and no smell.,Negative,10.08.2024
A1,1309,Big Basket,Flavour of ghee not upto the mark,Negative,10.08.2024
A1,1310,Big Basket,"purchased several times, but this time got highly Adulterated product, pathetic quality control from Big basket",Negative,10.08.2024
A1,1311,Big Basket,it seems duplicate product being sold,Negative,10.08.2024
A1,1312,Big Basket,very good price,Positive,10.08.2024
A1,1313,Big Basket,very good product,Positive,10.08.2024
A1,1314,Big Basket,very small discount than other mall,Neutral,10.08.2024
A1,1315,Big Basket,"in first attempt these were available,and delivery was in time",Neutral,10.08.2024
A1,1316,Big Basket,Expiry date is too sort,Neutral,10.08.2024
A1,1317,Big Basket,best quality at an affordable price. All products from the amul stable are always the most trusted,Positive,10.08.2024
A1,1318,Big Basket,Good it’s like original,Positive,10.08.2024
A1,1319,Big Basket,Quality wise no question arise.,Positive,10.08.2024
A1,1320,Big Basket,Taste is Not that good even smell also.. seems like vanaspati is mixed,Negative,10.08.2024
A1,1321,Big Basket,good,Positive,10.08.2024
A1,1322,Big Basket,Good,Positive,10.08.2024
A1,1323,Big Basket,good,Positive,10.08.2024
A1,1324,Big Basket,very bad ghee ever tasted in my life ...only better in advertising,Negative,10.08.2024
A1,1325,Big Basket,good product,Positive,11.08.2024
A1,1326,Big Basket,"VERY promot service and,, very very qualitative items",Positive,11.08.2024
A1,1327,Big Basket,good as usual,Positive,11.08.2024
A1,1328,Big Basket,Nice ghee,Positive,11.08.2024
A1,1329,Big Basket,very good product,Positive,11.08.2024
A1,1330,Big Basket,Good,Positive,11.08.2024
A1,1331,Big Basket,not at all good mixed ghee,Negative,11.08.2024
A1,1332,Big Basket,We trust Amul Products. It's always pure and gives more for money.,Positive,11.08.2024
A1,1333,Big Basket,Good product,Positive,11.08.2024
A1,1334,Big Basket,always a 5 star,Positive,11.08.2024
A1,1335,Amazon,Product is very good,Positive,11.08.2024
A1,1336,Amazon,Good product ??,Positive,11.08.2024
A1,1337,Amazon,One of the best quality ghee available in Amazon,Positive,11.08.2024
A1,1338,Amazon,The aroma itself defines it's purity.. Once I tried to substitute with other products but that was not at all a good day idea.. The taste is so good,Positive,11.08.2024
A1,1339,Amazon,Amazing smell and taste,Positive,11.08.2024
A1,1340,Amazon,"I was using GRB ghee from long time, this 1LTR GRB ghee doesn't have any aroma, also ghee looks like oil, thickness of ghee don't exist",Negative,11.08.2024
A1,1341,Amazon,"The best ghee , the taste & flavor is the best.",Positive,11.08.2024
A1,1342,Amazon,Over cover wrapping missing please provide wrapping,Neutral,11.08.2024
A1,1343,Amazon,Ok,Neutral,11.08.2024
A1,1344,Amazon,super,Positive,11.08.2024
A1,1345,Amazon,My favorite one.,Positive,11.08.2024
A1,1346,Amazon,Good product,Positive,11.08.2024
A1,1347,Amazon,Since it came damaged and seal open i suspect quality,Negative,11.08.2024
A1,1348,Amazon,Ghee was not as per our previous exp of GRB ghee. It's very thick...,Negative,11.08.2024
A1,1349,Amazon,"Product tastes original, smells original. But In reality it is a very good HITECH ADULTERATED PRODUCT. You may try some other brand to know the difference",Negative,11.08.2024
A1,1350,Amazon,"Never buy it online, shipping cost is also too much, offline you can buy it ,the taste is good but the problem is with packaging",Negative,11.08.2024
A1,1351,Amazon,Good quality,Positive,11.08.2024
A1,1352,Amazon,good quality ghee. I'm from India and I prefer Indian brand ghee (GRB) which tastes good. I have tried UK based ghee products but I was not much satisfied like this one. So I also prefer this one.,Positive,11.08.2024
A1,1353,Amazon,Satisfactory product,Neutral,11.08.2024
A1,1354,Amazon,Good Flavour Ghee...,Positive,12.08.2024
A1,1355,Amazon,every thing excellent,Positive,12.08.2024
A1,1356,Amazon,"Great quality for price product. I use a lot of this for cooking, versatile product for baking and also Indian influence cooking and popcorn??.",Positive,12.08.2024
